"监控主题","优先级","状态","标题","发布日期","URL","摘要"
"线下真人社交","critical","known","Breeze: Can a Dutch app save Brits from swiping past our dismal dating scene? | The Independent","2026-05-31T05:00:00.000Z","https://www.independent.co.uk/life-style/breeze-dating-app-tinder-hinge-b2983703.html","The Dutch couple are one of many success stories spawning from the dating app Breeze, which launched in Europe in 2020 before landing in London in 2025. Breeze promises date nights without endless swiping, and banishes the talking stage (what’s your favourite colour? How many siblings do you have?”) by only opening the chat window two hours before the date. When you match with someone, you put your availability into "
"线下真人社交","critical","known","Breeze Launches IRL Group Dates Across London - Global Dating Insights","2026-05-28T10:10:47.000Z","https://www.globaldatinginsights.com/featured/breeze-launches-irl-group-dates-across-london/","Breeze Launches IRL Group Dates Across London - Global Dating Insights [...] Breeze has launched real-life group date events across London, marking the first time since the platform has moved beyond the conventional one-on-one dating format in any official capacity. The current structure allows for up to eight singles at a venue, with no pre-emptive chats or meetings required – attendees simply show up and take part "
"线下真人社交","critical","known","WeRoad raises $58M and expands to the US with Airbnb | WeRoad","2026-05-27T08:26:00.000Z","https://www.weroad.com/blog/weroad-closes-a-58-million-launch-us","WeRoad raises $58M and expands to the US with Airbnb | WeRoad [...] # WeRoad closes a $58 million Series C round. And now, we’re heading to the United States [...] WeRoad closes a €58 million round to accelerate international growth and launch in the US. The Italian travel-tech company aims to scale its group travel model for Millennials and Gen Z globally. [...] - $58 million Series C round closed by WeRoad, led by "
"线下真人社交","critical","known","Airbnb-backed WeRoad raises $58M to take its group travel platform to the US | TechCrunch","2026-05-27T08:00:00.000Z","https://techcrunch.com/2026/05/27/airbnb-backed-weroad-raises-58m-to-take-its-group-travel-platform-to-the-us/","# Airbnb-backed WeRoad raises $58M to take its group travel platform to the US | TechCrunch [...] Airbnb-backed WeRoad raises $58M to take its group travel platform to the US [...] WeRoad, the Milan-based group travel startup, has raised a $58 million Series C round led by Airbnb as it prepares for its first major expansion outside Europe. The funding brings the company’s total capital raised to roughly $100 million "
"融资 / 商业化","high","known","Sekai raises $20 million as people create 15 million AI mini apps","2026-06-01T13:00:04.000Z","https://www.axios.com/2026/06/01/sekai-mini-app-startup-funding","Sekai raises $20 million as people create 15 million AI mini apps [...] # Exclusive: Sekai raises $20M for AI app creation [...] Sekai has raised a $20 million Series A to grow a platform for creating mini apps through text prompts, founder and CEO Lucky Zhang exclusively tells Axios. [...] Why it matters: The founder, who previously sold startups to Apple and TikTok parent ByteDance, is betting AI-generated software"
"融资 / 商业化","high","known","Status AI Raises $17 Million to Turn Social Media Into Worlds Users Can Live Inside - Fundraise Insider","2026-05-28T21:18:10.000Z","https://fundraiseinsider.com/blog/status-ai-raises-17-million-to-turn-social-media-into-worlds-users-can-live-inside/","Status AI Raises $17 Million to Turn Social Media Into Worlds Users Can Live Inside - Fundraise Insider [...] Status AI, an interactive social media app, has announced $17 million in combined seed and Series A funding. The backers include General Catalyst, Y Combinator, LightShed Partners, and Abstract. The raise reflects a wager that the next chapter of consumer social will not be another feed, but interactive enter"
"融资 / 商业化","high","known","Sesame, the conversational AI startup from Oculus founders, launches its iOS app | TechCrunch","2026-05-28T15:35:43.000Z","https://techcrunch.com/2026/05/28/sesame-the-conversational-ai-startup-from-oculus-founders-launches-its-ios-app/","# Sesame, the conversational AI startup from Oculus founders, launches its iOS app | TechCrunch [...] # Sesame, the conversational AI startup from Oculus founders, launches its iOS app [...] On Thursday, the AI startup Sesame, co-founded by Oculus’s founders and others from the VR company that sold to Meta, released a public preview of the conversational AI agents it’s been developing for over a year. With its new iO"
"中国 AI 社交出海","high","known","China’s MiniMax records 1-million client base, fivefold growth in half a year | South China Morning Post","2026-05-28T09:00:05.000Z","https://www.scmp.com/tech/tech-trends/article/3355156/chinas-minimax-records-1-million-client-base-fivefold-growth-half-year","China’s MiniMax records 1-million client base, [...] in half a year | South China Morning Post [...] ### Its global user base reaches 300 million while ARR more than doubles in two months, though company reports large total losses [...] Chinese artificial intelligence (AI) company MiniMax says it recorded a fivefold surge in its global enterprise and developer client base over the past six months, highlighting the sh"
"中国 AI 社交出海","high","known","China AI Upstart MiniMax Doubles Sales Ahead of New Model - Bloomberg","2026-05-28T00:00:00.000Z","https://www.bloomberg.com/news/articles/2026-05-28/china-ai-upstart-minimax-doubles-sales-ahead-of-new-model-launch","China AI Upstart MiniMax Doubles Sales Ahead of New Model - Bloomberg [...] Yun Yeyi, co-founder and president at MiniMax, discusses the company’s business strategy and outlook for the AI sector in China. She speaks with Stephen Engle from the sidelines of the UBS Asian Investment Conference in Hong Kong.Source: Bloomberg [...] MiniMax Group Inc.’s annualized revenue more than doubled over the past two months to at l"
"融资 / 商业化","high","known","Teamily AI Officially Enters the Singapore Market, Launching its Personal AI Agent OS -- Redefining Personal AGI Through Self-Improving AI+Human Social Network","2026-05-26T01:00:00.000Z","https://www.prnewswire.com/apac/news-releases/teamily-ai-officially-enters-the-singapore-market-launching-its-personal-ai-agent-os--redefining-personal-agi-through-self-improving-aihuman-social-network-302781009.html","Backed by US$20M in Seed Funding, Teamily AI Aligns with Singapore's National AI Strategy 2.0 to Redefine the Future of Human+AI Collaboration [...] SINGAPORE, May 26, 2026 /PRNewswire/ -- Teamily AI, the Silicon Valley-based pioneer behind the world's first human+AI social network app (an AI-native blend of WhatsApp, TikTok, and Instagram), today announced its official entry into the Singapore market with the simult"
"研究 / 政策风险","high","known","Suicide and self-harm in the age of generative artificial intelligence: The case of ChatGPT and rise of suicide-related lawsuits - ScienceDirect","2026-05-25T16:24:40.000Z","https://www.sciencedirect.com/science/article/abs/pii/S0165032726008773",": The case of [...] # Suicide and self-harm in the age of generative artificial intelligence: The case of ChatGPT and rise of suicide-related lawsuits [...] ## Suicide-related lawsuits against AI companies [...] GenAI has rapidly permeated in public health, where it holds significant potential to enhance mental health assessment, detection, and treatment (Elyoseph et al., 2024). Before the recent proliferation of Gen"
"融资 / 商业化","high","known","Forget the feed: Status AI raises $17M to turn social media into interactive entertainment | TechCrunch","2026-05-19T14:00:00.000Z","https://techcrunch.com/2026/05/19/gamified-social-media-network-status-announces-17m-funding-to-help-usher-in-new-era-of-social-networking/","Forget the feed: Status AI raises $17M to turn social media into interactive entertainment | TechCrunch [...] # Forget the feed: Status AI raises $17M to turn social media into interactive entertainment [...] 7:00 AM PDT · May 19, 2026 [...] Like many young people of her generation, Fai Nur was what she called a “chronically online teenager.” She obsessed over music groups, TV shows, and movies, and never missed the "
"Coverage signal watchlist","medium","known","Meta is trying to turn AI glasses into a subscription business","2026-05-31T22:10:00.000Z","https://webiano.digital/meta-is-trying-to-turn-ai-glasses-into-a-subscription-business/","Meta’s reported AI pendant sounds, at first, like a small hardware story. It is not. It is a test of whether Meta can move artificial intelligence out of the browser tab, out of the phone app, and into a device that is close enough to the body to see, hear, remember, and act. Reuters reported on May 29, 2026, citing The Information, that Meta plans to test an AI pendant next year and is preparing a wider wearable pus"
"Coverage signal watchlist","medium","known","Meta Develops AI Pendant, Expands Wearables Lineup — Web Pulse","2026-05-31T10:20:59.000Z","https://wpnews.pro/news/meta-develops-ai-pendant-expands-wearables-lineup","# Meta Develops AI Pendant, Expands Wearables Lineup [...] According to reporting by The Information and follow-up coverage from Reuters, Meta Platforms is developing an AI-powered pendant and plans to start testing it within the next year. The memo cited by those outlets, attributed to Alex Himel, Meta's vice president of wearables, also reportedly outlines an expansion of AI smart-glasses models and a new enterpris"
"投放 / 付费获客证据","medium","known","Meta’s Advantage+ Creative Is Rewriting DTC Ad Economics in 2026 – Ecommerce Times","2026-05-31T00:06:57.000Z","https://ecommerce-times.com/metas-advantage-creative-is-rewriting-dtc-ad-economics-in-2026/","For the past six months, a quiet restructuring has been underway inside the Meta ad accounts of mid-market DTC brands. Advantage+ Creative — Meta’s automated creative optimization layer — has moved from a cautious experiment to a core campaign architecture for brands spending $50K to $2M per month on the platform. The results, according to agency operators and brand-side media buyers, are real but uneven, and the ope"
"投放 / 付费获客证据","medium","known","Meta’s Advantage+ Overhaul Is Rewriting DTC Acquisition Math – Online Store News","2026-05-29T00:43:51.000Z","https://onlinestorenews.com/metas-advantage-overhaul-is-rewriting-dtc-acquisition-math/","If you run paid social for a DTC brand and haven’t rebuilt your Meta campaign structure in the last 90 days, there’s a real chance you’re leaving meaningful revenue on the table. That’s the blunt assessment circulating across agency Slack channels this week as Meta’s expanded Advantage+ Shopping Campaigns — rolled out in waves since Q1 2026 — start delivering results that are genuinely hard to ignore. For store opera"
"Residual IRL watchlist","medium","known","AppLovin Launches Its Own TikTok Rival","2026-05-28T21:29:13.000Z","https://wersm.com/applovin-launches-its-own-tiktok-rival/","After unsuccessfully trying to buy TikTok last year, adtech giant AppLovin is taking a different route: building its own social platform. [...] The company has quietly launched a new app called **Gist**, an invite-only social feed that feels like a mix between TikTok, Lemon8, Pinterest, and RedNote. Users can browse videos, photo carousels, mini-games, lifestyle content, travel recommendations, career advice, and eve"
"Coverage signal watchlist","medium","known","Sesame AI Launches iOS App: Next-Gen Chatbot Mimics Human Conversation - Headlinez News","2026-05-28T15:45:40.000Z","https://headlinez.news/sesame-ai-launches-ios-app-next-gen-chatbot-mimics-human-conversation/","Sesame, the conversational AI startup founded by former Oculus executives, launched its iOS app today after raising $250 million in Series B funding, marking a pivotal step toward its vision of blending AI companionship with wearable technology. [...] For years, AI chatbots have been trapped in the same awkward rhythm: rapid-fire responses that feel robotic or deliberate pauses that feel unnatural. Sesame is betting "
"投放 / 付费获客证据","medium","known","OpenAI turns on cost-per-action ads inside ChatGPT","2026-05-28T14:40:31.000Z","https://digiday.com/marketing/openai-turns-on-cost-per-action-ads-inside-chatgpt/","# OpenAI turns on cost-per-action ads inside ChatGPT [...] OpenAI has switched on cost-per-action ads inside its ads manager, Digiday has learned. [...] The feature, which is currently available to select advertisers only, lets them pay for ads in ChatGPT only when a user takes a specific action, whether that’s clicking through to a site, signing up or making a purchase. Until now, advertisers have had to pay for eve"
"投放 / 付费获客证据","medium","known","Pinterest’s New AI-Powered Shopping Ads Are Forcing DTC Brands to Rethink Their Upper-Funnel Spend – Online Store News","2026-05-28T02:44:28.000Z","https://onlinestorenews.com/pinterests-new-ai-powered-shopping-ads-are-forcing-dtc-brands-to-rethink-their-upper-funnel-spend/","For most of the last five years, Pinterest has occupied an awkward spot in the DTC media mix — respected for its purchase-intent signals but perpetually overshadowed by Meta’s scale and TikTok’s cultural pull. That dynamic is shifting fast. Pinterest’s Performance+ suite, which rolled out broadly to Shopify and WooCommerce merchants in late April 2026, is generating enough early return-on-ad-spend data to push seriou"
"投放 / 付费获客证据","medium","known","Meta’s Advantage+ Shopping Campaigns Are Rewriting DTC Ad Math in 2026 – Ecommerce Times","2026-05-27T01:06:04.000Z","https://ecommerce-times.com/metas-advantage-shopping-campaigns-are-rewriting-dtc-ad-math-in-2026/","Something structural shifted in Meta’s ad ecosystem in late Q1 2026. Across Shopify-native DTC brands running between $50,000 and $500,000 per month in Meta spend, a clear pattern has emerged: brands that fully migrated their prospecting and retargeting budgets into Meta’s Advantage+ Shopping Campaigns (ASC) are reporting customer acquisition costs that are, in many cases, 28 to 41 percent lower than their legacy man"
"Coverage signal watchlist","medium","known","Teamily AI Officially Enters the Singapore Market, Launching its Personal AI Agent OS -- Redefining Personal AGI Through Self-Improving AI+Human Social Network","2026-05-26T01:00:00.000Z","https://www.prnewswire.com/apac/news-releases/teamily-ai-officially-enters-the-singapore-market-launching-its-personal-ai-agent-os--redefining-personal-agi-through-self-improving-aihuman-social-network-302781009.html","SINGAPORE, May 26, 2026 /PRNewswire/ -- Teamily AI, the Silicon Valley-based pioneer behind the world's first human+AI social network app (an AI-native blend of WhatsApp, TikTok, and Instagram), today announced its official entry into the Singapore market with the simultaneous launch of its highly anticipated iOS and Android mobile applications. Backed by US$20M in funding, the company is introducing its personal and"
"Coverage signal watchlist","medium","known","Teamily AI Officially Enters the Singapore Market, Launching its Personal AI Agent OS -- Redefining Personal AGI Through Self-Improving AI+Human Social Network - Siam News Network","2026-05-26T01:00:00.000Z","https://www.siamnewsnetwork.net/pr-news/teamily-ai-officially-enters-the-singapore-market-launching-its-personal-ai-agent-os-redefining-personal-agi-through-self-improving-aihuman-social-network/","SINGAPORE, May 26, 2026 /PRNewswire/ — Teamily AI, the Silicon Valley-based pioneer behind the world’s first human+AI social network app (an AI-native blend of WhatsApp, TikTok, and Instagram), today announced its official entry into the Singapore market with the simultaneous launch of its highly anticipated iOS and Android mobile applications. Backed by US$20M in funding, the company is introducing its personal and "
"语言交换 / 跨文化社交","medium","known","Learning Portuguese in Brazil: Expat Shortcut to Fluency 2026 | The Rio Times","2026-05-25T16:32:42.000Z","https://www.riotimesonline.com/learning-portuguese-in-brazil-expat-guide/","— Live conversation accelerates everything. No app alone will get you to B1. Weekly sessions with a native tutor compress progress dramatically. [...] The combination that produces the fastest results for adult learners in Brazil is: a structured app or course for grammar foundations, a weekly tutor for speaking and correction, and daily immersion in Brazilian Portuguese audio and text. All three elements serve diffe"
"语言交换 / 跨文化社交","medium","known","Why Promova Is Quietly Becoming the Most Addictive AI Language App Beyond Duolingo + Video - UNDERCODE NEWS","2026-05-24T18:34:43.000Z","https://undercodenews.com/why-promova-is-quietly-becoming-the-most-addictive-ai-language-app-beyond-duolingo-video/","# Why Promova Is Quietly Becoming the Most Addictive AI Language App Beyond Duolingo + Video - UNDERCODE NEWS [...] Among the apps trying to redefine the category, Duolingo still sits at the top in popularity. Millions rely on its gamified approach to stay motivated every day. Yet another app is slowly building a loyal following by focusing on something many learners care about more than virtual rewards: speaking nat"
"Residual IRL watchlist","medium","known","AppLovin launches Gist, a social app that could change everything","2026-05-23T20:27:29.000Z","https://ppc.land/applovin-launches-gist-a-social-app-that-could-change-everything/","AppLovin this month stepped beyond its identity as an ad-tech platform by quietly publishing a consumer social app called Gist- a lifestyle-focused product built around tips, personal stories, discussions, articles, videos, and mini-games. The move had no press release attached, no keynote, no coordinated launch campaign. Industry observers spotted it on May 21, 2026, when mobile growth analyst Nebojsa Radovic posted"
"投放 / 付费获客证据","medium","known","Reddit introduces new optimisation and attribution features for advertisers","2026-05-21T06:23:43.000Z","https://www.socialsamosa.com/news-2/reddit-optimisation-attribution-advertisers-11857673","# Reddit introduces new optimisation and attribution features for advertisers ## While Reddit app installs from ad campaigns rose 129% in a year it is also expanding AI-powered Max campaigns and has testing new Dual Attribution, a first-party attribution and measurement tool. author-image [...] Social Samosa 21 May 2026 1 [...] Reddit on Wednesday announced a series of updates for app advertisers, including wider acc"
"投放 / 付费获客证据","medium","known","Discord Play Quest Drives PC Installs at $0.46 for Where Winds Meet Launch | Discord | Create With","2026-05-20T20:11:00.000Z","https://www.createwith.com/tool/discord/updates/discord-play-quest-drives-pc-installs-at-046-for-where-winds-meet-launch","Discord has published results from a Play Quest campaign with NetEase Games that turned the platform into the top acquisition channel for Where Winds Meet, a new PC open-world RPG, during its launch week. The campaign achieved a cost per install of $0.46 by rewarding players with Discord Orbs for gameplay rather than simple engagement. [...] The Play Quest model targets players already interested in a title and incen"
"投放 / 付费获客证据","medium","new","Reddit Expands First-Party Measurement 05/20/2026","2026-05-20T13:00:12.000Z","https://www.mediapost.com/publications/article/415202/reddit-expands-first-party-measurement.html","by Laurie Sullivan [...] , 20 minutes ago [...] Looking to give advertisers another way to look at app ad-measurement data, Reddit on Wednesday released “Dual Attribution” into beta. The move is Reddit’s foray into its own first-party data-measurement tool that places reporting alongside third-party mobile-measurement partners (MMPs) in Reddit Ads Manager, as well as Apple’s SKAdNetwork. The idea is to give advertise"
"投放 / 付费获客证据","medium","known","Omio's Global Expansion Powered by Appier's Agentic AI: Scaling Acquisition Across 21 Markets","2026-05-20T06:30:00.000Z","https://www.prnewswire.com/news-releases/omios-global-expansion-powered-by-appiers-agentic-ai-scaling-acquisition-across-21-markets-302777165.html","NEW YORK, May 20, 2026 /PRNewswire/ -- Appier, a leading AI Agent as a Service (AaaS) company transforming AdTech and MarTech through autonomous decisioning, announced its successful collaboration with Omio, a global travel booking platform, to expand user acquisition from Spain into a broad European presence within one year, consistently meeting CPA targets and maximizing ROI through Agentic AI-driven optimization. "
"Coverage signal watchlist","medium","known","Forget the feed: Status AI raises $17M to turn social media into interactive entertainment | TechCrunch","2026-05-19T14:00:00.000Z","https://techcrunch.com/2026/05/19/gamified-social-media-network-status-announces-17m-funding-to-help-usher-in-new-era-of-social-networking/","Forget the feed: Status AI raises $17M to turn social media into interactive entertainment | TechCrunch [...] # Forget the feed: Status AI raises $17M to turn social media into interactive entertainment [...] 7:00 AM PDT · May [...] , 202 [...] Like many young people of her generation, Fai Nur was what she called a “chronically online teenager.” She obsessed over music groups, TV shows, and movies, and never missed t"
