"目标主线","近窗信号数","新增","已知","critical","示例"
"投放/付费获客证据","10","5","5","0","4月AI月报：全球原生AI下载3.65亿，豆包、即梦等大陆市场下载量全面收缩-36氪 | How Brez Is Winning Meta in 2026 With a Radical Creative Rotation System – D2C Times | AI Marketing Tool AdLibrary.com Launches the First Cross-Platform Ad Library With Over 1 Billion Ads and AI-Powered Creative Analysis – North Headlines"
"线下真人社交","10","0","10","1","Breeze Launches IRL Group Dates Across London - Global Dating Insights | China’s MiniMax records 1-million client base, fivefold growth in half a year | South China Morning Post | New “what’s happening in Lisbon” app launches today – Portugal Resident"
"融资/商业化","10","3","7","0","Super US-Listed IPO: Reshaping Valuation Anchors of MiniMax and Zhipu AI | Neura Closes Strategic Funding Round and Partnerships to Build Emotional AI with Persistent, User-Owned Memory - Decrypt | Sekai Raises $26M as Platform Reaches 15 Million User-Created Apps | Gate News"
"覆盖缺口信号","3","0","3","0","Meta launches Creator Assistant AI for Facebook creators | Nectar Social Raises $30M, Rebrands Itself as Nectar Agent - Demand Gen Report | Meta is building an AI Pendant and this time it has a working wearables business behind it — TFN"
"研究/政策风险","2","1","1","1","Eat No Solo: Eating alone is becoming the norm: One app wants to fix that - RTL Today | Substance-induced manic psychosis in which delusions were corroborated by a chatbot - case report | BMC Psychiatry | Springer Nature Link"
"语言交换/跨文化社交","2","1","1","0","Language App Ling Challenges Automated Education Trend, Champions 'Human-First' Approach to Fluency | Web3Wire | Korean language app Teuida surpasses 6 million downloads with AI-driven conversation simulations"
