"目标主线","近窗信号数","新增","已知","critical","示例"
"线下真人社交","5","0","5","1","OpenToBites Launches App That Enables Diners to Find Company by Sharing Tables | China&#039;s AI Companion Apps Hit $7 Billion — Tech Giants Race to Cash In | singaporeinformer.com | Twice As Many Americans Are Now Using AI Companions Than Dating Apps: SensorTower Data"
"投放/付费获客证据","4","1","3","0","Turnout Announces $35M Series A to Put an AI Advocate in Every American’s Corner | MojiMoshi Embeds AI Agents Inside Telegram and Line, No App Needed - AINews | OpenAI Launches ChatGPT Advertising Business in Japan Amid Rising AI Costs | AJU PRESS"
"融资/商业化","2","0","2","0","Tryll Engine Raises $600K Pre-Seed at $6M Valuation to Bring On-Device AI Characters and Conversations to Games – Unite.AI | Tryll launches AI gaming engine alpha and secures $600K pre-seed funding - Tech.eu"
"覆盖缺口信号","2","0","2","0","Pixi's new iOS app turns text messages into interactive AR experiences | TechCrunch | Character.AI is adding new tools for chatbot creators. | The Verge"
"研究/政策风险","1","0","1","0","Frontiers | The adaptive ecological trap: a grounded theory study of adolescent AI dependency"
"语言交换/跨文化社交","1","1","0","0","HelloTalk - Learn Languages – Apps on Google Play"
